,sample_id,source_id,source_subject,source_domain,target_domain,target_subject,target_field,relations,source_paragraph,target_paragraph,distractor_target_paragraph,random_target_paragraph
102,720How does a hurricane form?,720,How are clouds formed?,Natural Sciences,Natural Sciences,How does a hurricane form?,Meteorology,"(water droplets, condense, air) like (moisture, condense, atmosphere). (warm air, rises, higher altitudes) like (warm air, rises, higher elevations). (water droplets, freeze, clouds) like (moisture, freeze, storms)","Clouds are formed when water droplets in the air condense. As warm air rises to higher altitudes, the pressure decreases and the water droplets in the air start to freeze, forming clouds. The water droplets in the air become too heavy to be suspended in the air and so they form clouds.","A hurricane forms when moisture in the atmosphere condenses and warms air rises to higher elevations. As the air rises, the moisture begins to freeze and is drawn into the eye of the storm. The warm air and moisture combine to create powerful winds that can cause destruction. The condensation of moisture in the atmosphere and the rising of warm air to higher elevations are essential components in the formation of a hurricane."," The warm air and moisture combine to create powerful winds. Following this, moisture in the atmosphere condenses and warm air rises to higher elevations. As the air rises, moisture begins to freeze and is drawn into the eye of the storm. Finally, these processes cause the formation of a hurricane.","The farmer chooses a crop that will grow well in his region.
The farmer tills the soil to loosen it.
The farmer spreads seeds.
The farmer tills again to plant the seeds.
Crops grow."
103,1058How does an automated washing machine work?,1058,How does a dishwasher work?,Engineering,Engineering,How does an automated washing machine work?,Mechanical Engineering,"(pump, circulates, water) like (motor, circulates, detergent). (spray arms, spins, water) like (agitator, spins, clothes). (heating element, warms, water) like (heating element, warms, detergent)","The dishwasher works by circulating water throughout the appliance with a pump. The water is then sprayed onto the dishes through a pair of spinning spray arms. A heating element is used to warm the water before it is sprayed onto the dishes, ensuring a thorough clean.","The automated washing machine works by using a motor to circulate the detergent around the drum of the machine. The agitator then spins the clothes inside the drum to ensure that the detergent and water covers them. The motor also activates a heating element, which warms up the detergent to a certain temperature to help with the cleaning process."," The motor activates a heating element, which warms up the detergent to facilitate the cleaning process. Then, the agitator spins the clothes inside the drum to ensure that the detergent and water cover them. Finally, the automated washing machine uses a motor to circulate the detergent around the drum of the machine.","Take out an ice cube tray.
Fill the tray with water from the faucet.
Put the ice cube tray in the freezer.
Wait for several hours.
The water will freeze and become ice.
Remove the ice cube tray from the freezer.
Remove the ice cubes from the tray."
104,76How does a glacier form?,76,How does sedimentary rock form?,Natural Sciences,Natural Sciences,How does a glacier form?,Geology,"(sediments, accumulate, over time) like (snow, accumulate, over time). (sediments, compact, into layers) like (snow, compact, into layers). (sediments, harden, into rock) like (snow, harden, into ice)","Sedimentary rock is formed over time as sediments accumulate. These sediments are compacted into layers and gradually harden into rock. The sediments have been deposited by wind, water, and other geological processes, and then compressed and cemented together over time. This compaction and cementation of sediments is what forms sedimentary rock.","A glacier forms over time as snow accumulates in an area. The snow compacts and hardens into layers, forming a dense mass of ice. The pressure of the heavy ice causes the snow layers to harden even further and become a glacier."," The pressure of the heavy ice causes the snow layers to harden even further and become a glacier. After the formation of the glacier, snow accumulates in the area. Then, the snow compacts and hardens into layers, forming a dense mass of ice.","Humans are born as babies.
Babies become infants.
Infants become children.
Children learn skills.
Children become teenagers.
Teenagers undergo puberty.
Teenagers become adults.
Adults have children.
Adults become elderly.
Elderly humans die."
105,1265How does a beaver build a dam?,1265,How does a bird build a nest?,Natural Sciences,Natural Sciences,How does a beaver build a dam?,Ecology,"(bird, gathers, twigs) like (beaver, gathers, sticks). (bird, interweaves, branches) like (beaver, interweaves, logs). (bird, secures, materials) like (beaver, secures, debris)",A bird builds a nest by gathering twigs and interweaving them with branches. It then secures the materials together with mud or saliva to form a sturdy structure. The bird then lines the nest with soft materials such as grass or feathers for insulation and comfort.,"Beavers build dams by gathering sticks and logs and interweaving them together. They then secure the debris to the structure to ensure it is strong and sturdy. The beavers will then use mud, rocks, and sand to plug any gaps and reinforce the dam."," Initially, beavers use mud, rocks, and sand to plug any gaps and reinforce the dam. After that, they gather sticks and logs and interweave them together. Finally, they secure the debris to the structure to ensure it is strong and sturdy.","Two birds meet each other.
Egg is produced after fertilziation.
Mother sits on egg until it hatches.
Bird Hatches.
Grows up.
Flee the next.
Starts family.
Dies."
106,1295How does a water filtration system purify water?,1295,How does a desalination plant remove salt from water?,Engineering,Social Sciences,How does a water filtration system purify water?,Environmental Science,"(salt, dissolves, water) like (contaminants, dissolves, water). (desalination, removes, salt) like (filtration, removes, contaminants). (brine, created, desalination) like (filtrate, created, filtration)","Salt dissolves in water, making it difficult to remove. Desalination is the process of removing salt from seawater or brackish water. In a desalination plant, the water is filtered through a membrane which allows water molecules to pass through and leave the salt behind. This process creates a brine solution which is then discarded, removing the salt from the water.","A water filtration system purifies water by removing contaminants that have dissolved in the water. The filtration process removes the contaminants, leaving behind a filtered water called the filtrate. The filtrate is created by the filtration process, and it is free of contaminants."," A water filtration system begins to purify water by removing contaminants that have dissolved in the water. After the contaminants are removed, a filtered water called the filtrate is left behind. Then, the filtration process removes the contaminants. Finally, the filtrate, free of contaminants, is created.","Fuel mixes with air.
Mix gets inducted into cylinder.
Piston compresses the mix.
Spark plug emits a spark that ignites it causing combustion.
Combustion gases expand.
Pushes piston during power stroke.
Exhaust valve opens to vent exhaust out tail pipe."
107,1137How does an eagle spot its prey from a distance?,1137,How do owls hunt at night?,Natural Sciences,Natural Sciences,How does an eagle spot its prey from a distance?,Ornithology,"(owls, locate, prey) like (eagles, locate, prey) . (owls, use, wings) like (eagles, use, wings) . (owls, employ, sharp vision) like (eagles, employ, sharp vision)","Owls are predators that hunt at night. They use their wings and sharp vision to locate prey. Their wings enable them to fly silently and their sharp vision allows them to locate prey even in the dark. Owls employ their hearing as well, which helps them track down their prey. By combining all these features, owls are able to hunt successfully at night.","Eagles are able to locate and spot their prey from a distance by using their wings to soar high in the sky and employ their sharp vision. Their eyesight is incredibly powerful and can pick out the tiniest of movements, allowing them to identify and track their prey with ease. This helps them to swoop down and capture their target quickly and efficiently."," Eagles use their wings to soar high in the sky. Without spotting or tracking their prey, they swoop down and capture their target. After capturing their target, they employ their sharp vision to locate and spot their prey from a distance. Finally, they identify and track their prey.","Electromagnet creates magnetic field with electricity.
Conductive copper wire is wrapped around a piece of metal.
An electric current gets introduced from power source.
Flows through the wire.
Magnetic field gets created in the wire.
And the metal gets magnetized.
When turned off it is no longer magnetic."
108,635Describe the life cycle of a bee,635,Describe the life cycle of a bird,Natural Sciences,Natural Sciences,Describe the life cycle of a bee,Natural Sciences,"(bird, hatches, from an egg) like (bee, hatches, from a larva). (bird, migrates, to warmer climates) like (bee, migrates, to sunnier spots). (bird, builds, a nest) like (bee, builds, a hive). (bird, produces, offspring) like (bee, produces, new colonies)","The life cycle of a bird begins when it hatches from an egg. Once the bird has grown, it begins to build a nest and produce offspring. When the weather becomes colder, the bird migrates to warmer climates. Once it arrives in its new environment, the bird begins the cycle again by building a nest and reproducing.","A bee begins its life cycle when it hatches from a larva. It then migrates to sunnier spots to forage for food. When the bee finds a suitable location, it builds a hive and produces new colonies. The bee then continues to feed and take care of the new colonies until it reaches the end of its life cycle."," A bee begins its life cycle when it hatches from a larva. It then finds a suitable location, builds a hive, and produces new colonies. After creating new colonies, the bee migrates to sunnier spots to forage for food. The bee then continues to feed and take care of the new colonies until it reaches the end of its life cycle.","Magma rises to the surface during a volcano.
The magma undergoes changes in temperature.
The magma undergoes changes in pressure.
The magma cools.
The magma solidifies.
The magma crystallizes.
Igneous rock is formed."
109,135How do dolphins use sonar?,135,How do bats use echolocation?,Natural Sciences,Natural Sciences,How do dolphins use sonar?,Marine Biology,"(bats, emit, sound waves) like (dolphins, emit, sound waves). (bats, detect, objects) like (dolphins, detect, objects). (bats, interpret, echoes) like (dolphins, interpret, echoes)","Bats use echolocation to navigate in the dark. To do this, they emit sound waves, which bounce off of objects in the environment and return to the bats as echoes. The bats then detect the echoes and interpret the information, allowing them to locate and identify the objects around them.","Dolphins use sonar to help them navigate and detect objects in their environment. They emit sound waves that travel through the water and bounce off of objects, creating echoes. Dolphins then interpret the echoes to gain information about their surroundings. This helps them detect objects in their environment, such as food sources or predators."," Dolphins interpret these echoes to gain information about their surroundings. After interpreting the echoes, dolphins emit sound waves that travel through water and bounce off objects. These sound waves then create echoes. Finally, dolphins use sonar to navigate and detect objects.","Different kinds of rocks melt into magma.
Magma cools in the crust.
Magma goes to the surface and becomes lava.
Lava cools.
Cooled magma and lava become igneous rock."
110,779How does a mechanical system of water purification works?,779,How do plants obtain and use water?,Natural Sciences,Engineering,How does a mechanical system of water purification works?,Mechanical Engineering,"(roots, absorb, water) like (filters, absorb, contaminants). (xylem, transport, water) like (pump, transport, purified water). (stomata, regulate, water loss) like (valves, regulate, flow rate)","Plants obtain water from their environment by their roots absorbing the water in the soil. The absorbed water then moves through the xylem in the stem of the plant and is transported to the leaves. The stomata in the leaves regulate the water loss from the plant, allowing it to take in the water it needs while preventing excessive water loss.","A mechanical system of water purification works by utilizing filters to absorb contaminants from the water. The pump then transports the purified water through the system, while valves regulate the flow rate. The filters absorb contaminants from the water, while the pump transports the purified water and the valves regulate the flow rate."," Initially, valves regulate the flow rate. Then, the pump transports the purified water through the system. Finally, a mechanical system of water purification uses filters to absorb contaminants from the water.","Sunlight shines on plants.
Cells with chlorophyll in them capture the light energy.
Plants absorb carbon dioxide through their stoma.
Plants absorb water through their roots and other parts of themselves.
Plants absorb minerals through their roots.
Plants convert these inputs into sugars.
Sugars can be used as energy sources.
Oxygen and water are also produced.
Excess water and oxygen are released through stoma and other parts of the plant."
111,796How does a mechanical system of air conditioning work?,796,How do the lungs work?,Biomedical and Health Sciences,Engineering,How does a mechanical system of air conditioning work?,Mechanical Engineering,"(lungs, inhale, oxygen) like (air conditioner, inhale, air). (alveoli, exchange, gases) like (evaporator, exchange, heat). (capillaries, absorb, oxygen) like (condenser, absorb, heat)","The lungs inhale oxygen from the atmosphere.  The inhaled oxygen then passes through the alveoli, where the exchange of gases occurs. The oxygen is then absorbed by the capillaries, which transport it throughout the body.  The alveoli also expel carbon dioxide from the body during exhaling.","A mechanical system of air conditioning works by inhaling air from the outside. This air passes through the evaporator where it exchanges heat with the refrigerant, cooling the air. The refrigerant then passes through the condenser, absorbing the heat from the air. Finally, the cooled air is released back into the room."," The mechanical system of air conditioning works by inhaling air from the outside. The refrigerant then passes through the condenser, absorbing the heat from the air. Afterward, the air passes through the evaporator where it exchanges heat with the refrigerant to cool it. Finally, the cooled air is released back into the room.","One goes to a wilderness area.
One sets up a tent.
One puts their clothes, sleeping bag, etc. into the tent.
One gathers firewood.
One builds a fire for warmth, cooking, etc."
112,315How does corrosion cause metal to break apart?,315,How does weathering cause rocks to break apart?,Natural Sciences,Engineering,How does corrosion cause metal to break apart?,Materials Engineering,"(wind, erodes, rock surface) like (acid, corrodes, metal surface). (rain, wears away, rock) like (salt, wears away, metal). (temperature fluctuations, expand, rocks) like (temperature fluctuations, expand, metal)","Weathering is the process of breaking down rocks by natural forces. Wind and rain erode the rock surface and wear away at the rock. Temperature fluctuations also play a role in weathering, as the expansion and contraction of the rocks due to temperature changes can cause them to break apart.","Corrosion of metals is a common phenomenon caused by the reaction of the metal surface with acids. Acids corrode the metal surface, which can cause cracks and holes in the metal. The presence of salt in the environment can also wear away the metal, making it more susceptible to corrosion. Temperature fluctuations can also cause metal to expand and contract, leading to cracks and breaks over time."," The presence of salt in the environment wears away the metal, making it more susceptible to corrosion. Following this, the reaction of the metal surface with acids causes corrosion. As a result of this corrosion, cracks and holes form in the metal. Finally, temperature fluctuations cause the metal to expand and contract, leading to further cracks and breaks over time.","Thunderstorms form over the ocean.
An area of low pressure causes rotation.
Several thunderstorms come together around this area.
The storm is fed by rising air from warm ocean water evaporating.
When the wind speeds reach 74 mph the storm is considered a hurricane."
113,225How does a solar-powered water heater work?,225,How does a battery-operated sewing machine work?,Engineering,Engineering,How does a solar-powered water heater work?,Electrical Engineering,"(battery, supplies, electrical current) like (solar panel, supplies, electrical current). (motor, rotates, needle) like (pump, circulates, water). (electrical circuit, controls, motor) like (electrical circuit, controls, pump)","The battery-operated sewing machine runs on electricity supplied by a battery. The battery supplies the electrical current that is used to power the motor. The motor then rotates the needle to sew the fabric. The electrical circuit is responsible for controlling the speed and power of the motor, and it regulates the electrical current flowing through the machine.","A solar-powered water heater uses energy from the sun to heat water. The solar panel supplies electrical current to an electrical circuit, which controls a pump. The pump circulates the water through the solar collector, where it absorbs the heat from the sun. The heated water is then sent to the storage tank, where it is available for use."," The solar-powered water heater uses energy from the sun to heat water. The water absorbs the heat from the sun while in the solar collector. Then, the solar panel supplies electrical current to an electrical circuit. The electrical circuit controls a pump. The pump circulates the water through the solar collector. The heated water is then sent to the storage tank. Finally, the heated water is available for use.","Your body accomplishes ""rapid hemostasis"" (stops the bleeding) through a process called vasoconstriction, in which your blood vessels are closed tight.
Inflammation is your body's way of alerting you of an injury.
Proliferation and migration is when cells move in a certain orderto been to heel and to further contract blood vessels. and.
The body then begins the process of rebuilding tissue and is called angiogenesis.
It's time to begin regrowing damaged skin which is called reepithelialization.
Synthesis often happens almost simultaneously as it form blood clots.
Synthesis helps further prevent bleeding as new skin and veins are formed."
114,51How does a metal alloy form?,51,How do minerals form?,Natural Sciences,Engineering,How does a metal alloy form?,Materials Engineering,"(atoms, bond together, molecules) like (elements, bond together, alloy). (crystals, grow, solid form) like (grains, grow, amalgam). (pressure, squeeze, rocks) like (heat, squeeze, metals)","Minerals form when atoms bond together to form molecules. These molecules then form crystals which grow in a solid form. The pressure of the surrounding environment can squeeze and heat rocks, creating the perfect conditions for mineral formation.","Metal alloys are formed when elements bond together to form an amalgam. This is done by heating and squeezing the metals together. As a result, the grains of the metals grow together to form a single alloy. The heat and pressure cause the elements to mix and form the alloy."," Initially, elements are prepared to form an amalgam. Then, the grains of the metals grow together to form a single alloy. After the grains have grown together, the elements are heated and compressed together. Finally, under the heat and pressure, the elements mix to form the alloy.","Turn the bicycle upside down.
Remove the nuts that hold the wheel to the bike.
Take the tire off of the wheel.
Patch the hole in the tire or replace with a new tire on the wheel.
Replace the wheel on the bike.
Secure the wheel with nuts."
115,475How does the greenhouse effect work?,475,Describe the process of global warming,Natural Sciences,Natural Sciences,How does the greenhouse effect work?,Environmental Science,"(sunlight, radiates, Earth's surface) like (sunlight, radiates, atmosphere). (heat, gets trapped, by greenhouse gases) like (heat, gets trapped, by clouds). (temperature, rises, average global temperature) like (temperature, rises, local temperature)","Global warming is caused by the process of trapping heat from sunlight that radiates onto the Earth's surface. Greenhouse gases such as water vapor, carbon dioxide and methane act like a blanket, trapping the heat in the atmosphere and preventing it from escaping into space. This increase in the atmospheric temperature causes the average global temperature to rise, resulting in climate change.","Sunlight radiates into the atmosphere and some of this radiation is trapped by clouds, which causes the heat to get trapped. This trapped heat causes the local temperature to rise, which is known as the greenhouse effect. The greenhouse effect is what causes the average global temperature to increase."," Sunlight radiates into the atmosphere. This radiation then causes the greenhouse effect, which increases the average global temperature. Following this, some of the radiation is trapped by clouds, leading to trapped heat. Finally, this trapped heat causes the local temperature to rise, creating the greenhouse effect.","Choose what you want to write your letter on.
Think of what you want to say.
Write some nice things!.
Place the letter into an envelope.
Put a stamp on the top right corner of the face of the envelope.
Write the address of the recipient on the envelope.
Put the envelope in your mailbox.
Raise the flag on your mailbox, indicating to the mailman that you have outgoing mail."
116,1310Describe how bears hibernate.,1310,Describe how squirrels prepare for winter.,Natural Sciences,Natural Sciences,Describe how bears hibernate.,Animal Biology,"(squirrels, store, acorns) like (bears, store, fat). (squirrels, create, nests) like (bears, build, dens). (squirrels, gather, food) like (bears, collect, food)","Squirrels prepare for winter by storing acorns and gathering food to last them through cold months. They also create nests in tree hollows or in the ground, which provide insulation and keep them warm. Acorns provide a good source of food for squirrels, and by storing them, they are able to ensure that they have enough food for the winter.","Hibernation is a process where bears store fat to survive the winter. To prepare for hibernation, bears build dens that provide shelter from the cold temperatures. During the fall, bears collect food to store enough fat for the winter. This fat is then converted into energy, allowing bears to survive until spring when they emerge from their dens."," Bears store fat to prepare for hibernation. During fall, they collect food to accumulate enough fat for the winter. After collecting food, they build dens to provide shelter for the cold months. In spring, they emerge from their dens. After emerging, the fat is converted into energy allowing them to survive until the next spring.","Water flows into the dishwasher.
The dishwasher heats the water.
The detergent dispenser opens at the right time.
Water is shot through the jets to clean the dishes.
The dirty water is drained.
More water is sprayed to rinse the dishes.
The water is drained again.
The air is heated in the dishwasher to dry the dishes."
117,517Describe the life cycle of a butterfly,517,Describe the life cycle of a frog,Natural Sciences,Natural Sciences,Describe the life cycle of a butterfly,Natural Sciences,"(egg, hatches, tadpole) like (cocoon, hatches, caterpillar). (tadpole, metamorphoses, frog) like (caterpillar, metamorphoses, butterfly). (frog, lays, eggs) like (butterfly, lays, eggs)","The life cycle of a frog starts with an egg which hatches into a tadpole. The tadpole grows and eventually undergoes metamorphosis, transforming into a frog. The frog then lays eggs, which begin the cycle anew.","The life cycle of a butterfly begins when a cocoon hatches and a caterpillar emerges. The caterpillar feeds and grows before it metamorphoses into a butterfly. Once it has transformed, the butterfly will lay eggs and eventually die, completing the cycle."," The life cycle of a butterfly begins when a cocoon hatches and a caterpillar emerges. Immediately, the butterfly lays eggs. Following this, it metamorphoses into a butterfly. After its transformation, the caterpillar feeds and grows. Eventually, the butterfly dies, completing the cycle.","An owl leaves his nest.
The owl flys out into the night.
The owl looks down at the ground.
The owls keen eyesight allows him to see in the dark.
The owls sensitive hearing allows him to locate hidden prey.
The owl swoops down.
The owl catches a mouse in his talons."
