,sample_id,source_id,source_subject,source_domain,target_domain,target_subject,target_field,relations,source_paragraph,target_paragraph,distractor_target_paragraph,random_target_paragraph
296,666How does the filtration of water works?,666,Describe the process of desalination,Engineering,Engineering,How does the filtration of water works?,Chemical Engineering,"(salt, separates, water) like (contaminants, separates, water). (osmosis, reduces, salt content) like (adsorption, reduces, impurity content). (reverse osmosis, filters, water) like (filtration, filters, water)","Desalination is the process of removing salt from water. This is achieved by separating the salt from the water, usually through the process of osmosis. Osmosis is a process that uses pressure to reduce the salt content in the water. The water is then passed through a reverse osmosis filter, which filters out the salt and other impurities, leaving clean water.","Filtration is a process used to separate contaminants from water. The process of adsorption helps to reduce the impurity content of the water. Adsorption is the process of attracting and binding contaminants to a medium, such as a filter. By passing the water through a filter, impurities are trapped in the filter and the filtered water has a lower impurity content. The filtration process helps to filter out unwanted particles, leaving clean and safe water."," Filtration is a process used to separate contaminants from water. The water is then passed through a filter, trapping impurities in the filter and leaving the filtered water with a lower impurity content. After the water has been filtered, the process of adsorption helps to reduce the impurity content of the water by attracting and binding contaminants to a medium, such as a filter. Finally, the filtration process filters out unwanted particles, leaving clean and safe water.","Wind and water erode rocks.
The wind and water pick up sediment that came off the rocks.
Sediment is carried to an area by the wind, water, air, or ice.
Sediment is deposited on the same spot many times.
The sediment piles on top of other sediment for a long time.
The sediment near the bottom is compressed by the weight of newer sediment.
The sediment becomes sedimentary rock as it is pushed together by the heavy weight."
297,611How do viruses spread and cause disease?,611,Describe how bacteria can cause disease.,Biomedical and Health Sciences,Natural Sciences,How do viruses spread and cause disease?,Microbiology,"(bacteria, invade, cells) like (viruses, invade, cells). (bacteria, produce, toxins) like (viruses, produce, toxins). (bacteria, cause, infection) like (viruses, cause, infection)","Bacteria can cause disease by invading cells and producing toxins. These toxins can cause inflammation and infection in the body. Bacteria can spread rapidly and cause serious damage to the body. The toxins produced by bacteria can cause the cells to become weakened and unable to fight off the infection. This can lead to a wide range of diseases, from mild to life threatening.","Viruses can spread and cause disease when they invade cells. Once inside the cells, the viruses replicate and produce toxins that can cause infection. The toxins produced by the viruses can damage the cells, leading to inflammation and disruption of normal cell functioning, which can lead to disease."," Viruses can spread and cause disease when they invade cells. This invasion leads to inflammation and disruption of normal cell functioning, which can lead to disease. Once inside the cells, the viruses replicate and produce toxins. These toxins then damage the cells, further exacerbating the disease.","You eat food.
Your stomach digests the food.
Sugars from food enter your bloodstream.
Insulin helps turn sugars into energy.
Insulin helps your body store the energy in fat, muscle and liver cells."
298,742How do dolphins use sonar?,742,How do bats use echolocation?,Natural Sciences,Natural Sciences,How do dolphins use sonar?,Marine Biology,"(bats, emit, sound waves) like (dolphins, emit, sound waves) . (bats, receive, echoes) like (dolphins, receive, echoes) . (bats, interpret, echo patterns) like (dolphins, interpret, echo patterns)","Bats use echolocation to navigate and hunt for food. They emit high-frequency sound waves and then listen for echoes. Bats are able to interpret the echo patterns to determine the size, shape, and distance of objects. By listening to the echoes, bats are able to identify their prey and navigate through dark spaces with ease.",Dolphins use echolocation to navigate and find food. They emit sound waves and then wait for the echoes to return. These sound waves travel through the water and bounce off objects in the environment. Dolphins then receive the echoes and interpret the echo patterns to gain information about their surroundings.," Dolphins use echolocation to navigate and find food. They then receive the echoes and interpret the echo patterns to gain information about their surroundings. After receiving the echoes, they emit sound waves and then wait for the echoes to return. These sound waves travel through the water and bounce off objects in the environment.","Solution caves are formed in limestone and similar rocks by the action of water.
After a rain, water seeps into cracks and pores of soil and rock.
The water percolates beneath the land surface.
Some of the water reaches a zone where all the cracks and pores in the rock are already filled with water.
Rainwater absorbs some carbon dioxide as it passes through the atmosphere and even more as it drains through soil and decaying vegetation.
The water combines chemically with the carbon dioxide.
A weak carbonic acid solution is formed.
This acid slowly dissolves calcite, forms solution cavities, and excavates passageways."
299,365Describe how air pollution can affect the environment.,365,Describe how acid rain can affect the environment.,Natural Sciences,Engineering,Describe how air pollution can affect the environment.,Environmental Engineering,"(acid rain, corrodes, buildings) like (air pollution, corrodes, buildings). (acid rain, damages, vegetation) like (air pollution, damages, vegetation). (acid rain, acidifies, soil) like (air pollution, acidifies, soil)","Acid rain is caused by pollutants in the atmosphere, and can have a devastating effect on the environment. It is highly corrosive and can easily damage the outer layer of buildings and monuments. In addition, acid rain can damage vegetation and acidify soil, both of which can be difficult to repair. It is important for us to reduce the emissions that cause acid rain in order to protect our environment.","Air pollution can affect the environment in many ways. It can corrode buildings, damage vegetation, and acidify soil. The pollutants in the air, such as sulfur dioxide, nitrogen dioxide, and ozone, can react with other elements in the atmosphere to create a corrosive and acidic environment. This can cause a decrease in the quality of air, water, and soil, and can damage vegetation, corrode buildings, and acidify soil."," Air pollution occurs. This environment damages vegetation, corrodes buildings, and acidifies soil. Then, pollutants in the air such as sulfur dioxide, nitrogen dioxide, and ozone, react with other elements in the atmosphere. These reactions create a corrosive and acidic environment. Finally, this environment causes a decrease in the quality of air, water, and soil.","Networks of trees start forming.
The trees die off.
The dead material provides nutrients for more trees.
The rising trees provide shelter.
And more organisms begin to thrive.
The ecosystem known as a forest is made."
300,658Describe the life cycle of a bee,658,Describe the lifecycle of a butterfly,Natural Sciences,Social Sciences,Describe the life cycle of a bee,Social Sciences,"(butterfly, hatches, pupa) like (bee, hatches, larva). (caterpillar, feeds, on leaves) like (grub, feeds, on nectar). (adult butterfly, produces, offspring) like (adult bee, produces, drones)","The lifecycle of a butterfly starts when an egg hatches into a caterpillar. The caterpillar feeds on leaves and grows in size. Eventually, it forms a pupa and undergoes metamorphosis. Finally, an adult butterfly emerges and produces offspring to complete the cycle.","A bee begins its life as an egg which is laid by the queen and hatches into a larva. The larva, also known as a grub, feeds on nectar and honey stored in the hive in order to grow and develop. As an adult bee, it produces drones that continue the life cycle of the bee."," A bee egg is laid by the queen. Then, the adult bee produces drones. After the drones are produced, the bee egg hatches into a larva. The larva feeds on nectar and honey stored in the hive. Finally, the bee grows into an adult.","Skin is cut or damaged.
Bacteria enters through the wound.
The bacteria reproduces and spreads.
Causes symptoms.
The bacteria is either fought off or becomes a disease."
301,1144Describe how human activities can negatively affect wildlife,1144,Describe how forest fires can negatively affect animals,Natural Sciences,Social Sciences,Describe how human activities can negatively affect wildlife,Environmental Science,"(forest fire, destroys, habitats) like (human activities, destroys, habitats). (forest fire, increases, carbon emissions) like (human activities, increases, carbon emissions). (forest fire, reduces, food sources) like (human activities, reduces, food sources)","Forest fires can have devastating effects on animals, as they destroy habitats, increase carbon emissions, and reduce food sources. The fire destroys the trees and vegetation that provide habitats for many species of animals. Additionally, the fire releases carbon emissions into the atmosphere which contributes to air pollution. Lastly, the fire can reduce food sources for animals, as the plants and insects that they would normally feed on are burned away.","Human activities can have a negative effect on wildlife. These activities can include destroying habitats, increasing carbon emissions, and reducing food sources. The destruction of habitats has a direct impact on the wildlife living in them, as they are forced to find a new place to live or risk extinction. Increasing carbon emissions also has an effect on wildlife, as it can lead to climate change and global warming. Finally, reducing food sources can put pressure on the wildlife population, as they may not be able to find enough food to survive."," Increasing carbon emissions leads to climate change and global warming, affecting wildlife. Following this, human activities are performed, which includes destroying habitats, increasing carbon emissions, and reducing food sources. Subsequently, the destruction of habitats forces wildlife to find new homes or risk extinction. Finally, the reduction of food sources puts pressure on the wildlife population as they struggle to find enough food to survive.","Cold water taken in through a hose to the bottom.
Heating element heats water.
Pump forces water up in pipes connected to spinning paddles.
The forced water makes paddles spin like a sprinkler.
Water comes out of small holes in paddles.
Water is collected and used again until dishes are clean.
Water is drained through a filter.
Filter collects particles of food.
Water was so hot that it evaporates for dry dishes."
302,770How do the muscles of respiration work?,770,How do lungs work?,Biomedical and Health Sciences,Social Sciences,How do the muscles of respiration work?,Physiology,"(air, enters, lungs) like (oxygen, enters, blood). (lungs, expand, air) like (diaphragm, contracts, air). (oxygen, diffuses, into blood) like (oxygen, diffuses, into muscles)","When we breathe, air enters the lungs and expands them. The air is then sent to the alveoli, where oxygen diffuses into the blood. The oxygen is then distributed throughout the body and used for energy. The air that is left in the lungs is then exhaled, completing the cycle.","The muscles of respiration allow us to breathe. When we breathe, air enters our body through the diaphragm which contracts and relaxes. Oxygen in the air then diffuses into the blood stream and is transported to the muscles. The oxygen enters the muscles through the cell walls, where it can be used to create energy."," The muscles of respiration allow for breathing. Then, oxygen in the air diffuses to the bloodstream. After this, air enters the body through the contraction and relaxation of the diaphragm. Subsequently, oxygen is transported to the muscles from the bloodstream. Finally, oxygen enters the muscles through the cell walls and is used to create energy.","Animals may come across vegetation.
The animal may consume or get seeds stuck in their fur.
The animal travels some distance someplace else.
The seeds are dropped or deposited off.
The seeds have a new place to proliferate and grow."
303,443How do robots pollinate plants?,443,How do bees pollinate plants?,Natural Sciences,Engineering,How do robots pollinate plants?,Robotics Engineering,"(bees, collect, nectar) like (robots, collect, pollen). (bees, transfer, pollen) like (robots, transfer, pollen). (bees, pollinate, flowers) like (robots, pollinate, flowers)","Bees collect nectar from flowers and transfer the pollen to other flowers while they are doing so. This process is known as pollination, and it helps the flowers to reproduce. As the bees move from flower to flower, they are effectively transferring pollen and helping to facilitate the pollination of plants.","Robots are designed to collect pollen from flowers and transfer it to other flowers. This process of transferring the pollen from one flower to another helps to pollinate the flowers. The robots are able to accurately identify the flowers in need of pollination and deliver the pollen to the correct location. By doing so, the robots are able to successfully pollinate the plants."," Robots are designed to collect pollen from flowers. Then, the pollen is delivered to the correct location. After delivering the pollen, the robots identify the flowers in need of pollination. Following the identification, the process of transferring the pollen from one flower to another takes place. Finally, the plants are successfully pollinated.","Coal is crushed.
The coal is burned at high temperatures inside a boiler.
The heat generated converts water to steam.
The steam spins propeller blades in the turbine.
The spinning turbine rotates coils in the generator.
The rotating coils produce electricity.
The electricity can be sent through the power grid."
304,641Describe the growth and development of a butterfly,641,Describe the life cycle of a frog,Natural Sciences,Natural Sciences,Describe the growth and development of a butterfly,Entomology,"(egg, hatches, tadpole) like (caterpillar, hatches, chrysalis). (tadpole, matures, frog) like (chrysalis, matures, butterfly). (frog, lays, eggs) like (butterfly, lays, eggs)","A frog's life cycle begins when a female frog lays eggs in water. The eggs then hatch into tadpoles, which are small, fish-like creatures with a tail and gills. As the tadpole matures, it develops legs and lungs and eventually turns into a frog. The frog then lays eggs which start the life cycle over again.","The growth and development of a butterfly begins when a caterpillar hatches from an egg. It then goes through several moults before it forms a chrysalis. Inside the chrysalis, the caterpillar matures into a butterfly. Once it emerges from the chrysalis, the butterfly is ready to fly and lay eggs, completing the cycle of growth and development."," The growth and development of a butterfly begins when a caterpillar hatches from an egg. It then goes through several moults before it forms a chrysalis. Once it forms a chrysalis, the butterfly is ready to fly and lay eggs, completing the cycle of growth and development. Inside the chrysalis, the caterpillar matures into a butterfly. Finally, the butterfly emerges from the chrysalis.","There is a rain cloud in the sky.
Small bits of ice within the cloud bump each other.
The collisions create electrical charge.
Lighter, positively charged particles sink to the bottom of the cloud.
Heavier, negatively charges particles rise to the top.
When the positive and negative charges grow large enough, a giant spark, called lightning occurs."
305,846How does the lymphatic system remove waste from the human body?,846,How does blood remove waste from the human body?,Biomedical and Health Sciences,Biomedical and Health Sciences,How does the lymphatic system remove waste from the human body?,Biomedical and Health Sciences,"(blood, carries, toxins) like (lymph, carries, toxins). (kidney, filters, blood) like (lymph nodes, filters, lymph). (liver, detoxifies, blood) like (spleen, detoxifies, lymph)","Blood carries toxins and waste throughout the body. The kidney then filters the blood and removes these toxins from the body. The liver also plays an important role in the process of waste removal. It detoxifies the blood, breaking down toxins and helping the body to eliminate them.","The lymphatic system is responsible for carrying away toxins from the body. The lymph, a clear fluid, circulates through the body and carries the toxins away. The lymph nodes act as filters and work to remove unwanted particles from the lymph. The spleen also works to detoxify the lymph and remove any bacteria or viruses that may be present."," The lymphatic system carries away toxins from the body. Then, the spleen works to detoxify the lymph, removing bacteria or viruses. After the spleen has detoxified the lymph, it circulates through the body carrying the toxins away. Finally, the lymph nodes filter the lymph by removing unwanted particles.","A forest fire starts.
The trees and plants burn.
The animals lose their homes.
If the animals can not escape, they may die from smoke inhalation.
The plants that provide food are gone.
The animals have little to eat."
306,807How do you freeze water into ice cubes?,807,How do you make ice cubes?,Engineering,Social Sciences,How do you freeze water into ice cubes?,Chemistry,"(refrigerator, cools, air) like (freezer, cools, water). (condensation, forms, water droplets) like (sublimation, forms, ice cubes). (temperature, drops, below freezing) like (temperature, drops, below 0C)","To make ice cubes, the refrigerator cools the air inside it. This causes condensation to form, which are small water droplets. As the temperature drops below freezing, the water droplets turn into solid ice cubes.","To freeze water into ice cubes, you need to place it in the freezer. The freezer cools the water and causes the temperature to drop below 0C. At this point, the water molecules begin to slow down, and a process called sublimation occurs, where the water turns into ice cubes."," The freezer cools the water and causes the temperature to drop below 0C. After the water is cooled, it is then placed in the freezer. Once in the freezer, the water molecules begin to slow down. Finally, the sublimation process occurs, turning the water into ice cubes.","Water droplets in clouds collide.
Become bigger drops.
Ice particles also grow in clouds.
Drops and ice particles get heavier.
Drops fall to the ground.
Ice particles fall from the clouds.
Ice particles fall through warmer air and melt.
Ice reaches the ground as rain drops."
307,515Describe the life cycle of a butterfly,515,Describe the life cycle of a frog,Natural Sciences,Natural Sciences,Describe the life cycle of a butterfly,Entomology,"(Frog, hatches, tadpole) like (Butterfly, hatches, caterpillar). (Tadpole, develops, legs) like (Caterpillar, develops, wings). (Frog, metamorphoses, froglet) like (Butterfly, metamorphoses, chrysalis). (Froglet, matures, adult frog) like (Chrysalis, matures, adult butterfly)","A frog starts its life cycle when it hatches from an egg as a tadpole. As it grows, it develops legs and begins to metamorphose into a froglet. It then matures into an adult frog. The entire process from egg to adult frog typically takes 8-12 weeks.","A butterfly begins its life cycle when it hatches from an egg as a caterpillar. The caterpillar then feeds and develops wings as it grows. After a period of growth, the caterpillar undergoes metamorphosis, transforming into a chrysalis. In the chrysalis, the butterfly matures until it emerges as an adult butterfly."," A butterfly begins its life cycle when it hatches from an egg as a caterpillar. The caterpillar then feeds and develops wings as it grows. In the chrysalis, the butterfly matures until it emerges as an adult butterfly. After emerging as an adult butterfly, the caterpillar undergoes metamorphosis, transforming into a chrysalis.","A machine called a pulverizer grinds the coal into a fine powder.
The coal powder mixes with hot air, which helps the coal burn more efficiently, and the mixture moves to the furnace.
The burning coal heats water in a boiler, creating steam.
Steam released from the boiler powers an engine called a turbine, transforming heat energy from burning coal into mechanical energy that spins the turbine engine.
The spinning turbine is used to power a generator, a machine that turns mechanical energy into electric energy.
This happens when magnets inside a copper coil in the generator spin.
A condenser cools the steam moving through the turbine. As the steam is condensed, it turns back into water.
The water returns to the boiler, and the cycle begins again."
308,377Describe how carbon dioxide leaves cells in the body,377,Describe how oxygen reaches cells in the body,Biomedical and Health Sciences,Natural Sciences,Describe how carbon dioxide leaves cells in the body,Biology,"(lungs, take in, oxygen) like (lungs, release, carbon dioxide). (hemoglobin, carries, oxygen) like (hemoglobin, transports, carbon dioxide). (capillaries, absorb, oxygen) like (capillaries, expel, carbon dioxide)","The lungs take in oxygen from the air and it is then carried by hemoglobin molecules in the bloodstream. The hemoglobin molecules move through the capillaries, where oxygen is absorbed and released into the cells of the body. The cells require oxygen to carry out a variety of metabolic processes, so the delivery of oxygen to them is crucial for the maintenance of life.","The lungs are responsible for releasing carbon dioxide from the body. In order to do this, hemoglobin molecules transport carbon dioxide from the cells to the lungs. The capillaries in the lungs then expel the carbon dioxide into the air when we exhale."," Carbon dioxide is expelled into the air when we exhale. Following this, hemoglobin molecules transport carbon dioxide from the cells to the lungs. Finally, the capillaries in the lungs then expel the carbon dioxide.","Magma cools inside the crust.
Magma crystalizes.
Lava cools on the surface.
Lava crystalizes.
Minerals dissolved in water crystlize."
309,1137How do bats locate their prey?,1137,How do owls hunt at night?,Natural Sciences,Natural Sciences,How do bats locate their prey?,Animal Behavior,"(owls, use, sound waves) like (bats, use, echolocation). (ears, detect, sound waves) like (ears, detect, echoes). (sound waves, bounce off, prey) like (echoes, bounce off, prey)","Owls use sound waves to hunt at night. Their ears are highly sensitive and can detect the sound waves they emit. The sound waves bounce off their prey and they can use the reflected sound waves to locate where the prey is. By using sound waves, the owls have an advantage in the dark, as they can locate their prey with ease.","Bats use an intriguing method known as echolocation to locate their prey. They produce sound waves that travel through the air and bounce off the objects in the environment. Their ears detect the echoes that bounce off the prey, allowing them to locate it in their surroundings.  The bats use this method to find food in the dark, which helps them survive in their natural habitat."," Bats produce sound waves that travel through the air. Using these sound waves, bats locate their prey in the dark. After locating their prey, the sound waves bounce off the objects in the environment. Finally, the echoes that bounce off the prey are detected by the bats' ears.","A blood clot forms in the break.
Cells in the clot keep foreign objects out.
Cells create a soft callous.
Minerals are added to the callous.
The callous hardens because of the minerals.
The callous is removed by other cells.
Excess bone is removed.
The bone is restored to its initial shape and strength."
